name,ID,description,collection layers,platforms,created,modified,type,version,url,contributors
Service,DS0019,"A computer process that is configured to execute continuously in the background and perform system tasks, in some cases before any user has logged in(Citation: Microsoft Services)(Citation: Linux Services Run Levels)",Host,"Linux, Windows, macOS",20 October 2021,,datasource,1.0,https://attack.mitre.org/datasources/DS0019,Center for Threat-Informed Defense (CTID)
Service: Service Creation,,Initial construction of a new service/daemon (ex: Windows EID 4697 or /var/log daemon logs),,,20 October 2021,,datacomponent,1.0,,
Service: Service Metadata,,"Contextual data about a service/daemon, which may include information such as name, service executable, start type, etc.",,,20 October 2021,,datacomponent,1.0,,
Service: Service Modification,,"Changes made to a service/daemon, such as changes to name, description, and/or start type (ex: Windows EID 7040 or /var/log daemon logs)",,,20 October 2021,,datacomponent,1.0,,
Snapshot,DS0020,"A point-in-time copy of cloud volumes (files, settings, etc.) that can be created and/or deployed in cloud environments(Citation: Microsoft Snapshot)(Citation: Amazon Snapshots)",Cloud Control Plane,IaaS,20 October 2021,,datasource,1.0,https://attack.mitre.org/datasources/DS0020,Center for Threat-Informed Defense (CTID)
Snapshot: Snapshot Creation,,Initial construction of a new snapshot (ex: AWS create-snapshot),,,20 October 2021,,datacomponent,1.0,,
Snapshot: Snapshot Deletion,,Removal of a snapshot (ex: AWS delete-snapshot),,,20 October 2021,,datacomponent,1.0,,
Snapshot: Snapshot Enumeration,,An extracted list of snapshops within a cloud environment (ex: AWS describe-snapshots),,,20 October 2021,,datacomponent,1.0,,
Snapshot: Snapshot Metadata,,"Contextual data about a snapshot, which may include information such as ID, type, and status",,,20 October 2021,,datacomponent,1.0,,
Snapshot: Snapshot Modification,,"Changes made to a snapshop, such as metadata and control data (ex: AWS modify-snapshot-attribute)",,,20 October 2021,,datacomponent,1.0,,
User Account,DS0002,"A profile representing a user, device, service, or application used to authenticate and access resources","Cloud Control Plane, Container, Host","Azure AD, Containers, Google Workspace, IaaS, Linux, Office 365, SaaS, Windows, macOS",20 October 2021,,datasource,1.1,https://attack.mitre.org/data-sources/DS0002,Center for Threat-Informed Defense (CTID)
User Account: User Account Authentication,,"An attempt by a user to gain access to a network or computing resource, often by providing credentials (ex: Windows EID 4776 or /var/log/auth.log)",,,20 October 2021,,datacomponent,1.1,,
User Account: User Account Creation,,Initial construction of a new account (ex: Windows EID 4720 or /etc/passwd logs),,,20 October 2021,,datacomponent,1.0,,
User Account: User Account Deletion,,Removal of an account (ex: Windows EID 4726 or /var/log access/authentication logs),,,20 October 2021,,datacomponent,1.0,,
User Account: User Account Metadata,,"Contextual data about an account, which may include a username, user ID, environmental data, etc.",,,20 October 2021,,datacomponent,1.0,,
User Account: User Account Modification,,"Changes made to an account, such as permissions and/or membership in specific groups (ex: Windows EID 4738 or /var/log access/authentication logs)",,,20 October 2021,,datacomponent,1.0,,
Volume,DS0034,"Block object storage hosted on-premise or by third-party providers, typically made available to resources as virtualized hard drives(Citation: Amazon S3)(Citation: Azure Blob Storage)(Citation: Google Cloud Storage)","Cloud Control Plane, Host","IaaS, Linux, Windows, macOS",20 October 2021,,datasource,1.0,https://attack.mitre.org/datasources/DS0034,Center for Threat-Informed Defense (CTID)
Volume: Volume Creation,,Initial construction of a cloud volume (ex: AWS create-volume),,,20 October 2021,,datacomponent,1.0,,
Volume: Volume Deletion,,Removal of a a cloud volume (ex: AWS delete-volume),,,20 October 2021,,datacomponent,1.0,,
Volume: Volume Enumeration,,An extracted list of available volumes within a cloud environment (ex: AWS describe-volumes),,,20 October 2021,,datacomponent,1.0,,
Volume: Volume Metadata,,"Contextual data about a cloud volume and activity around it, such as id, type, state, and size",,,20 October 2021,,datacomponent,1.0,,
Volume: Volume Modification,,"Changes made to a cloud volume, including its settings and control data (ex: AWS modify-volume)",,,20 October 2021,,datacomponent,1.0,,
WMI,DS0005,The infrastructure for management data and operations that enables local and remote management of Windows personal computers and servers(Citation: Microsoft WMI System Classes)(Citation: Microsoft WMI Architecture),Host,Windows,20 October 2021,,datasource,1.0,https://attack.mitre.org/datasources/DS0005,Center for Threat-Informed Defense (CTID)
WMI: WMI Creation,,"Initial construction of a WMI object, such as a filter, consumer, subscription, binding, or provider (ex: Sysmon EIDs 19-21)",,,20 October 2021,,datacomponent,1.0,,
Web Credential,DS0006,"Credential material, such as session cookies or tokens, used to authenticate to web applications and services(Citation: Medium Authentication Tokens)(Citation: Auth0 Access Tokens)","Cloud Control Plane, Host","Azure AD, Google Workspace, Linux, Office 365, SaaS, Windows, macOS",20 October 2021,,datasource,1.0,https://attack.mitre.org/datasources/DS0006,
Web Credential: Web Credential Creation,,Initial construction of new web credential material (ex: Windows EID 1200 or 4769),,,20 October 2021,,datacomponent,1.0,,
Web Credential: Web Credential Usage,,An attempt by a user to gain access to a network or computing resource by providing web credentials (ex: Windows EID 1202),,,20 October 2021,,datacomponent,1.0,,
Windows Registry,DS0024,"A Windows OS hierarchical database that stores much of the information and settings for software programs, hardware devices, user preferences, and operating-system configurations(Citation: Microsoft Registry)",Host,Windows,20 October 2021,,datasource,1.0,https://attack.mitre.org/datasources/DS0024,
Windows Registry: Windows Registry Key Access,,"Opening a Registry Key, typically to read the associated value (ex: Windows EID 4656)",,,20 October 2021,,datacomponent,1.0,,
Windows Registry: Windows Registry Key Creation,,Initial construction of a new Registry Key (ex: Windows EID 4656 or Sysmon EID 12),,,20 October 2021,,datacomponent,1.0,,
Windows Registry: Windows Registry Key Deletion,,Removal of a Registry Key (ex: Windows EID 4658 or Sysmon EID 12),,,20 October 2021,,datacomponent,1.0,,
Windows Registry: Windows Registry Key Modification,,Changes made to a Registry Key and/or Key value (ex: Windows EID 4657 or Sysmon EID 13|14),,,20 October 2021,,datacomponent,1.0,,
